{
  "contractVersion": "1.0",
  "taskId": "task.1111111111111111111111111111111111111111111111111111111111111111",
  "requestDigest": "b032560b2cff0af91ac72eef1d6b3bd9a73dd2896b903f49b547559f16a7ad3d",
  "state": "running",
  "lastSequence": 1,
  "pendingQuestionId": null,
  "deliverySequence": null,
  "terminalSequence": null,
  "error": null,
  "createdAt": "2026-08-16T10:00:00Z",
  "updatedAt": "2026-08-16T10:00:01Z"
}
